{
  "$schema": "../packages/catalog/product-catalog.schema.json",
  "version": "2026-10-17.3",
  "verifiedOn": "2026-10-17",
  "disclaimer": "Estimates only. Not a quote, invoice, or commitment. Source rates resolve from captured first-party Azure and Databricks calculator data where supported; missing and conflicted prices remain unresolved. Planning assumptions and reference fallbacks are labeled separately. A catalog product does not guarantee availability in every cloud or region.",
  "categories": [
    {
      "id": "data_engineering",
      "label": "Data Engineering"
    },
    {
      "id": "warehousing_bi",
      "label": "Warehousing & BI"
    },
    {
      "id": "ai_ml",
      "label": "AI/ML"
    },
    {
      "id": "apps_oltp",
      "label": "Apps & OLTP"
    },
    {
      "id": "governance_sharing",
      "label": "Governance & Sharing"
    }
  ],
  "knownAzureMeters": [
    "Premium Jobs Compute DBU",
    "Premium All-purpose Compute DBU",
    "Premium SQL Analytics DBU",
    "Premium SQL Compute Pro DBU",
    "Premium Serverless SQL DBU",
    "Premium Automated Serverless Compute DBU",
    "Premium Interactive Serverless Compute DBU",
    "Premium Core Compute Delta Live Tables DBU",
    "Premium Pro Compute Delta Live Tables DBU",
    "Premium Advanced Compute Delta Live Tables DBU",
    "Premium Model Training DBU",
    "Premium Serverless Realtime Inferencing DBU",
    "Premium Database Serverless Compute DBU",
    "Premium Jobs Light Compute DBU",
    "Standard Jobs Light Compute DBU",
    "Standard All-purpose Compute DBU",
    "Standard Jobs Compute DBU",
    "Standard SQL Analytics DBU",
    "Premium Clean Rooms Collaborator Collaborator",
    "Premium Databricks Storage Unit DSU",
    "Premium Enhanced Security and Compliance DBU",
    "Premium Enhanced Security and Compliance - Mission Critical Add-on DBU",
    "Launch Charge Serverless Realtime Inferencing DBU",
    "Data Processed"
  ],
  "products": [
    {
      "published": true,
      "confidence": "measured",
      "automation": "azure-retail-prices",
      "editor": "builtin",
      "listPrice": "distinct",
      "fields": [],
      "patch": {},
      "azureMeterNames": [
        "Premium Jobs Compute DBU"
      ],
      "id": "jobs_classic",
      "name": "Lakeflow Jobs (classic)",
      "menuLabel": "Jobs cluster",
      "summary": "Scheduled work on your VMs",
      "category": "data_engineering",
      "billingUnit": "DBU-hour + VM-hour",
      "sku": "jobs_classic",
      "template": "jobs",
      "drivers": [
        "Node hours",
        "Instance DBU rating",
        "Photon",
        "Spot"
      ],
      "defaults": "2–4 × m5.xlarge, 8h × 5d, no Photon, no spot.",
      "source": {
        "title": "Azure Retail Prices API, Azure Databricks consumption meters",
        "url": "https://prices.azure.com/api/retail/prices?api-version=2023-01-01-preview",
        "fetchedOn": "2026-10-17"
      },
      "note": "Jobs Compute DBU. Photon changes DBU consumption: Azure Jobs uses 2.5×; AWS/GCP retain a 2.9× planning factor. Exact instance ratings can differ. Exact Azure Retail Prices meters and captured Databricks AWS/GCP price-card or calculator observations take precedence. The Unit costs view identifies each component’s actual source, observation date, scope, and any fallback or conflict.",
      "confidenceScore": 92
    },
    {
      "id": "jobs_light",
      "name": "Jobs Light",
      "menuLabel": "Jobs Light",
      "summary": "Azure meter only",
      "category": "data_engineering",
      "billingUnit": "DBU",
      "sku": "jobs_classic",
      "listPrice": "distinct",
      "published": true,
      "confidence": "measured",
      "automation": "azure-retail-prices",
      "template": "metered",
      "editor": "schema",
      "drivers": [
        "DBU on Azure"
      ],
      "defaults": "Example: 100 DBU. East US Premium is $0.22/DBU.",
      "source": {
        "title": "Azure Retail Prices API, Azure Databricks consumption meters",
        "url": "https://prices.azure.com/api/retail/prices?api-version=2023-01-01-preview",
        "fetchedOn": "2026-10-17"
      },
      "note": "Premium Jobs Light Compute is $0.22/DBU in Azure East US (Retail Prices, 2026-10-17). The shared component registry seeds this public reference rate and the forecast withholds it outside that scope. Standard Jobs Light is a different offering. Missing prices for another cloud or region remain unresolved; supply a labelled independent rate to price them.",
      "fields": [
        {
          "path": "dbuPerMonth",
          "label": "DBU / month",
          "type": "number",
          "min": 0,
          "step": 1
        }
      ],
      "patch": {
        "sku": "managed_services",
        "dbuPerMonth": 100
      },
      "azureMeterNames": [
        "Premium Jobs Light Compute DBU"
      ],
      "confidenceScore": 92
    },
    {
      "published": true,
      "confidence": "measured",
      "automation": "azure-retail-prices",
      "editor": "builtin",
      "listPrice": "distinct",
      "fields": [],
      "patch": {},
      "azureMeterNames": [
        "Premium Automated Serverless Compute DBU"
      ],
      "id": "jobs_serverless",
      "name": "Lakeflow Jobs (serverless)",
      "menuLabel": "Serverless jobs",
      "summary": "DBUs only, compute included",
      "category": "data_engineering",
      "billingUnit": "DBU-hour",
      "sku": "jobs_serverless",
      "template": "serverless_jobs",
      "drivers": [
        "DBU per hour",
        "Hours"
      ],
      "defaults": "8 DBU/hour, 8h × 5d.",
      "source": {
        "title": "Azure Retail Prices API, Azure Databricks consumption meters",
        "url": "https://prices.azure.com/api/retail/prices?api-version=2023-01-01-preview",
        "fetchedOn": "2026-10-17"
      },
      "note": "Automated Serverless Compute. Compute is included. Exact Azure Retail Prices meters and captured Databricks AWS/GCP price-card or calculator observations take precedence. The Unit costs view identifies each component’s actual source, observation date, scope, and any fallback or conflict.",
      "confidenceScore": 92
    },
    {
      "published": false,
      "confidence": "unpublished",
      "automation": "manual",
      "editor": "builtin",
      "listPrice": "reused_sku",
      "fields": [],
      "patch": {},
      "azureMeterNames": [],
      "id": "jobs_performance_mode",
      "name": "Lakeflow Jobs performance mode",
      "menuLabel": "Jobs performance mode",
      "summary": "No separate public meter",
      "category": "data_engineering",
      "billingUnit": "DBU-hour",
      "sku": "jobs_serverless",
      "template": "serverless_jobs",
      "drivers": [
        "Same drivers as serverless jobs"
      ],
      "defaults": "Same default as Serverless jobs.",
      "source": {
        "title": "Databricks pricing pages",
        "url": "https://www.databricks.com/product/pricing",
        "fetchedOn": "2026-10-16"
      },
      "note": "No separate performance-versus-standard meter was in the East US meter list on 2026-10-17. This line uses the Jobs serverless SKU. Do not apply a guessed mode multiplier.",
      "confidenceScore": 8
    },
    {
      "published": true,
      "confidence": "measured",
      "automation": "azure-retail-prices",
      "editor": "builtin",
      "listPrice": "distinct",
      "fields": [],
      "patch": {},
      "azureMeterNames": [
        "Premium All-purpose Compute DBU"
      ],
      "id": "all_purpose_classic",
      "name": "All-Purpose (classic)",
      "menuLabel": "All-purpose cluster",
      "summary": "Notebooks and exploration",
      "category": "data_engineering",
      "billingUnit": "DBU-hour + VM-hour",
      "sku": "all_purpose_classic",
      "template": "all_purpose",
      "drivers": [
        "Node hours",
        "Instance DBU rating",
        "Photon"
      ],
      "defaults": "1 × m5.xlarge, 6h × 5d.",
      "source": {
        "title": "Azure Retail Prices API, Azure Databricks consumption meters",
        "url": "https://prices.azure.com/api/retail/prices?api-version=2023-01-01-preview",
        "fetchedOn": "2026-10-17"
      },
      "note": "All-purpose Compute DBU plus the VM. Exact Azure Retail Prices meters and captured Databricks AWS/GCP price-card or calculator observations take precedence. The Unit costs view identifies each component’s actual source, observation date, scope, and any fallback or conflict.",
      "confidenceScore": 92
    },
    {
      "published": true,
      "confidence": "measured",
      "automation": "azure-retail-prices",
      "editor": "builtin",
      "listPrice": "distinct",
      "fields": [],
      "patch": {},
      "azureMeterNames": [
        "Premium Interactive Serverless Compute DBU"
      ],
      "id": "all_purpose_serverless",
      "name": "All-Purpose (serverless)",
      "menuLabel": "Serverless notebooks",
      "summary": "Interactive, no VM bill",
      "category": "data_engineering",
      "billingUnit": "DBU-hour",
      "sku": "all_purpose_serverless",
      "template": "serverless_notebooks",
      "drivers": [
        "DBU per hour",
        "Hours"
      ],
      "defaults": "4 DBU/hour, 6h × 5d.",
      "source": {
        "title": "Azure Retail Prices API, Azure Databricks consumption meters",
        "url": "https://prices.azure.com/api/retail/prices?api-version=2023-01-01-preview",
        "fetchedOn": "2026-10-17"
      },
      "note": "Interactive Serverless Compute. Exact Azure Retail Prices meters and captured Databricks AWS/GCP price-card or calculator observations take precedence. The Unit costs view identifies each component’s actual source, observation date, scope, and any fallback or conflict.",
      "confidenceScore": 92
    },
    {
      "published": true,
      "confidence": "measured",
      "automation": "azure-retail-prices",
      "editor": "builtin",
      "listPrice": "distinct",
      "fields": [],